<?xml version="1.0" encoding="UTF-8"?>
<MyRootElement xmlns:xsi="http://www.w3.org/2001/XMLSchema-instance" myAttribute="0" myRequiredAttribute="0"
               xmlns="http://www.bawi.com/my-schema" xsi:schemaLocation="http://www.bawi.com/my-schema my-schema.xsd"
               xmlns:other="http://www.bawi.com/my-imported-schema" >

    <MySubElement>anyType</MySubElement> <!-- can be replaced with: <MySubElement /> -->
    <MySubElementString>String</MySubElementString> <!-- can be replaced with: <MySubElementString /> -->
    <MySubElementOptional>anyType</MySubElementOptional> <!-- can be completely removed -->
    <MySubElementRequiring3CharString>aaa</MySubElementRequiring3CharString>
    <MySubElementDisallowingText/>

    <!-- can be replaced with:   <MySubElementWithOptionalAttrAndOptionalText /> -->
    <MyIncludedSubElementWithOptionalAttrAndOptionalText
            myIncludedIntegerAttribute="anySimpleType">String</MyIncludedSubElementWithOptionalAttrAndOptionalText>

    <other:MyImportedRootElement myImportedAttribute="0">
        <other:MyImportedSubElement>text</other:MyImportedSubElement>
    </other:MyImportedRootElement>

    <MyImportedRootElementViaType myImportedAttribute="0">
        <other:MyImportedSubElement>text</other:MyImportedSubElement>
    </MyImportedRootElementViaType>

    <MySubElementChoice>
        <Employee>Employee1</Employee>
    </MySubElementChoice>

    <Colors>
        <Color>red</Color>
        <Color>blue</Color>
    </Colors>

    <MySubElementNestedComplex myBooleanAttribute="false" myIndicatorEnumAttribute="F">
        <MyImportedRootElement myImportedAttribute="0">
            <other:MyImportedSubElement>text</other:MyImportedSubElement>
        </MyImportedRootElement>
        <MySubSubNestedElement mySubSubNestedElementAttr="anyAttrVal" mySubElementBaseAttribute="anyBaseAttrVal">
            <MySubElementBaseSubElement>anyType</MySubElementBaseSubElement>
            <SubElement1>anyType</SubElement1>
            <SubElement2>ABbc</SubElement2>
        </MySubSubNestedElement>
    </MySubElementNestedComplex>

</MyRootElement>
